insight,value,note
Female primary operators among agricultural land-operating households,46.7%,Weighted share from V9 analytical tables
Male primary operators among agricultural land-operating households,53.3%,Weighted share from V9 analytical tables
"Climate-livelihood shock exposure, female-operated households",90.3%,Weighted percentage
"Climate-livelihood shock exposure, male-operated households",89.3%,Weighted percentage
"Moderate/severe food-insecurity proxy, female-operated households",49.6%,Weighted percentage
"Moderate/severe food-insecurity proxy, male-operated households",51.4%,Weighted percentage
Adjusted hired labour association,OR 1.63 (95% CI 1.04–2.57),Female vs male primary operator among crop-producing households
Adjusted vegetables/tubers association,OR 0.50 (95% CI 0.29–0.85),Female vs male primary operator among land-operating households
